{
  "$schema": "http://json-schema.org/draft-07/schema#",
  "$id": "design.json.schema.json",
  "title": "design.json",
  "type": "object",
  "required": [
    "feature_id",
    "client_target",
    "client_targets",
    "title",
    "phase",
    "file_plan",
    "api_outline",
    "acceptance",
    "constraints",
    "dependencies",
    "risks"
  ],
  "properties": {
    "feature_id": {
      "type": "string",
      "pattern": "^[A-Z][A-Z0-9]*(-[A-Z][A-Z0-9]*)*-[0-9]{3}$"
    },
    "client_target": { "type": "string", "minLength": 1 },
    "client_targets": {
      "type": "array",
      "minItems": 1,
      "items": { "type": "string" }
    },
    "title": { "type": "string", "minLength": 1 },
    "phase": {
      "type": "string",
      "enum": ["mvp", "standard", "complete", "future"]
    },
    "file_plan": {
      "type": "object",
      "required": ["new_files", "modify_files"],
      "properties": {
        "new_files": {
          "type": "array",
          "items": {
            "type": "object",
            "required": ["path", "role"],
            "properties": {
              "path": { "type": "string", "minLength": 1 },
              "role": { "type": "string" }
            }
          }
        },
        "modify_files": {
          "type": "array",
          "items": {
            "type": "object",
            "required": ["path", "role"],
            "properties": {
              "path": { "type": "string", "minLength": 1 },
              "role": { "type": "string" }
            }
          }
        }
      }
    },
    "api_outline": {
      "type": "array",
      "items": {
        "type": "object",
        "required": ["method", "path", "summary"],
        "properties": {
          "method": { "type": "string" },
          "path":   { "type": "string" },
          "summary": { "type": "string" }
        }
      }
    },
    "data_outline": {},
    "acceptance": {
      "type": "array",
      "minItems": 3,
      "items": { "type": "string", "minLength": 1 }
    },
    "constraints": {
      "type": "array",
      "items": { "type": "string" }
    },
    "dependencies": {
      "type": "array",
      "items": {
        "type": "string",
        "pattern": "^[A-Z][A-Z0-9]*(-[A-Z][A-Z0-9]*)*-[0-9]{3}$"
      }
    },
    "risks": {
      "type": "array",
      "items": { "type": "string" }
    }
  }
}
