{
  "feature_id": "BACKEND-API-PIPELINE-001",
  "client_target": "backend",
  "client_targets": ["backend"],
  "title": "流水线运行数据上报 API",
  "phase": "mvp",
  "file_plan": {
    "new_files": [
      {
        "path": "src/backend/src/routes/v1/pipeline.ts",
        "role": "PUT /api/v1/projects/:id/pipeline 路由注册（复用 api-key-auth）"
      },
      {
        "path": "src/backend/src/handlers/v1/create-project.ts",
        "role": "Open API 创建项目：校验 req 对齐字段并写入 projects（source=open_api）"
      },
      {
        "path": "src/backend/src/handlers/v1/upsert-pipeline.ts",
        "role": "流水线上报：解析载荷、写入 pipeline_snapshots、更新 projects.pipeline_summary"
      },
      {
        "path": "src/backend/src/validators/open-api-project-create.ts",
        "role": "创建项目请求体校验（name_zh、name_en、description、client_targets、is_new）"
      },
      {
        "path": "src/backend/src/validators/pipeline-upsert.ts",
        "role": "上报载荷校验：stages/features/blocking_issues/log_tail 结构与大小上限"
      },
      {
        "path": "src/backend/src/services/projects-write.ts",
        "role": "projects 表插入（Open API）与按 id 存在性校验；与 projects-query 共用 schema"
      },
      {
        "path": "src/backend/src/services/pipeline-snapshot.ts",
        "role": "pipeline_snapshots upsert 与最新快照读取；normalize 上报载荷"
      },
      {
        "path": "src/backend/src/lib/pipeline-normalize.ts",
        "role": "将上报载荷规范化为 PROJECT-DASH-001 可读结构，容忍 stages.json 字段缺失"
      },
      {
        "path": "src/backend/src/db/migrations/0002_pipeline_snapshots.sql",
        "role": "pipeline_snapshots 表：project_id、payload_json、stages_hash、updated_at（projects/api_keys 由 QUERY-001 schema.sql 定义）"
      },
      {
        "path": "src/backend/tests/v1-pipeline-api.test.ts",
        "role": "Open API 创建项目与流水线上报的单元/集成测试"
      }
    ],
    "modify_files": [
      {
        "path": "src/backend/src/index.ts",
        "role": "挂载 v1/pipeline 路由；POST /api/v1/projects 可并入 v1/projects 或本 feature 注册"
      },
      {
        "path": "src/backend/src/routes/v1/projects.ts",
        "role": "在 BACKEND-API-QUERY-001 已规划的 GET 路由旁新增 POST /api/v1/projects（同文件、同 api-key-auth，避免双 projects.ts）"
      }
    ]
  },
  "api_outline": [
    {
      "method": "POST",
      "path": "/api/v1/projects",
      "summary": "API Key 鉴权下创建项目；请求体字段对齐 inputs/req.md（name_zh、name_en、description、client_targets、is_new）；成功返回 201 与 project id、初始 status"
    },
    {
      "method": "PUT",
      "path": "/api/v1/projects/:id/pipeline",
      "summary": "API Key 鉴权下上报流水线运行数据（stages、features、blocking_issues、log_tail、current_stage 等）；持久化至 pipeline_snapshots 并更新 projects.pipeline_summary；成功返回 200 与 snapshot 摘要"
    }
  ],
  "data_outline": "projects(id TEXT PK, name_zh TEXT NOT NULL, name_en TEXT NOT NULL, description TEXT, client_targets TEXT JSON NOT NULL, status TEXT NOT NULL, is_new INTEGER DEFAULT 0, source TEXT, root_path TEXT, pipeline_summary TEXT, created_at TEXT, updated_at TEXT); api_keys(id TEXT PK, key_hash TEXT UNIQUE NOT NULL, label TEXT, enabled INTEGER DEFAULT 1, created_at TEXT); pipeline_snapshots(id TEXT PK, project_id TEXT NOT NULL FK→projects.id, payload_json TEXT NOT NULL, stages_hash TEXT, updated_at TEXT NOT NULL)；Open API 创建时 source='open_api'，管理端创建 source='admin'，与 BACKEND-API-QUERY-001、PROJECT-LIST-001 共用 projects/api_keys 迁移",
  "acceptance": [
    "POST /api/v1/projects 在有效 API Key（Authorization: Bearer <key> 或 X-API-Key）下接受 name_zh、name_en、description、client_targets（仅 admin/backend）、is_new；校验失败返回 400 与可读 errors[]，成功返回 201 含 id 与 status，且无 Key/密码泄露",
    "缺少或无效 API Key 调用 POST /api/v1/projects 或 PUT /api/v1/projects/:id/pipeline 均返回 401，响应体不含 config.env 中的密钥配置",
    "PUT /api/v1/projects/:id/pipeline 对存在的 project_id 接受 stages/features/blocking_issues/log_tail 等载荷并写入 pipeline_snapshots；项目不存在返回 404；载荷超大或非法 JSON 返回 413/400",
    "上报成功后，同一 project_id 经 GET /api/projects/:id/pipeline（管理端 Session，由 PROJECT-DASH-001 实现）可读到与最近一次上报一致的 stages、features、blocking_issues、log_tail 结构化字段",
    "GET /api/v1/projects 与 GET /api/v1/projects/:id（BACKEND-API-QUERY-001）可查询到本接口 POST 创建的项目，且列表/详情字段与共用 projects 表一致"
  ],
  "constraints": [
    "目录与入口须与 AUTH-LOGIN-001、BACKEND-API-QUERY-001 一致：src/backend/src/index.ts、src/backend/src/middleware/api-key-auth.ts，禁止另建 src/backend/index.ts 或扁平 routes/v1/projects.ts",
    "Open API 路径前缀固定为 /api/v1/*，与管理端 Session API /api/* 分离；写操作必须经 api-key-auth",
    "client_targets 仅允许 prd-spec 声明的 admin、backend；禁止在代码或响应中硬编码 config.env 中的真实 API Key",
    "流水线上报须容忍 stages/features 字段缺失或部分为空，normalize 后仍须可持久化；不得因单字段缺失返回 5xx",
    "log_tail 与 payload_json 须设大小上限并在超限返回 413；错误响应不得包含服务器绝对路径、D1 内部错误栈",
    "PUT 为唯一写入口径（不支持 PATCH），与 prd-backend endpoints 一致",
    "projects、api_keys 表结构以 BACKEND-API-QUERY-001 的 schema.sql 为准，本 feature 仅追加 pipeline_snapshots 迁移，不得重复定义冲突的 projects/api_keys 列"
  ],
  "dependencies": [],
  "risks": [
    "POST /api/v1/projects 与 GET 路由同文件合并时须注意 Hono 路由注册顺序，避免路径遮蔽",
    "超大 pipeline 快照可能导致 D1 行大小或 Workers 响应体超限，须严格执行 log_tail/payload 上限",
    "与 PROJECT-CREATE-001 双通道写 projects 时 source 字段须区分 admin 与 open_api"
  ]
}
