{
  "feature_id": "PROJECT-CREATE-001",
  "client_target": "backend",
  "client_targets": ["admin", "backend"],
  "title": "新建项目（req 表单字段）",
  "phase": "mvp",
  "file_plan": {
    "new_files": [
      {
        "path": "src/backend/src/validators/project-create.ts",
        "role": "POST /api/projects 请求体校验：name_zh、name_en、description、client_targets 白名单、is_new"
      },
      {
        "path": "src/backend/src/services/projects-create.ts",
        "role": "管理端创建项目：生成 id、写入 projects（source=admin）、初始 status=active、返回 DTO"
      },
      {
        "path": "src/backend/tests/projects-create.test.ts",
        "role": "创建 201/400/401/403、client_targets 非法值、is_new 持久化与列表可查"
      },
      {
        "path": "src/admin/src/constants/clientTargets.ts",
        "role": "客户端目标多选选项常量（admin、backend），与 prd-spec 一致"
      },
      {
        "path": "src/admin/src/components/ProjectCreateForm.tsx",
        "role": "新建项目表单：中英名称、简介、client_targets 多选、is_new 展示/提交"
      },
      {
        "path": "src/admin/src/pages/ProjectCreatePage.tsx",
        "role": "路由页 /projects/new：表单容器、提交态、成功跳转列表、错误展示"
      }
    ],
    "modify_files": [
      {
        "path": "src/backend/migrations/0002_projects.sql",
        "role": "若缺列则补充 source TEXT DEFAULT 'admin'、确保 is_new/description 与 Open API 共用 schema 一致"
      },
      {
        "path": "src/backend/src/routes/projects.ts",
        "role": "注册 POST /api/projects（require-session + require-admin-role）"
      },
      {
        "path": "src/backend/src/db/schema.ts",
        "role": "补充 projects 插入类型与 source/is_new 字段"
      },
      {
        "path": "src/backend/src/index.ts",
        "role": "确认 projects 路由已挂载（与 LIST 共用）"
      },
      {
        "path": "src/admin/src/api/projects.ts",
        "role": "新增 createProject(body) 调用 POST /api/projects"
      },
      {
        "path": "src/admin/src/App.tsx",
        "role": "受保护路由 /projects/new，仅 admin/super_admin 可访问（operator 重定向或 403 页）"
      },
      {
        "path": "src/admin/src/pages/ProjectListPage.tsx",
        "role": "「新建项目」按钮仅对 admin/super_admin 可见；operator 隐藏或禁用"
      }
    ]
  },
  "api_outline": [
    {
      "method": "POST",
      "path": "/api/projects",
      "summary": "有效 Session 且角色为 admin/super_admin 时创建项目；请求体含 name_zh、name_en、description、client_targets（admin|backend 子集）、is_new；成功返回 201 与项目 id、status、is_new、updated_at；写入 source=admin"
    }
  ],
  "data_outline": "projects 表与 PROJECT-LIST-001、BACKEND-API-PIPELINE-001 共用：id TEXT PK, name_zh TEXT NOT NULL, name_en TEXT NOT NULL, description TEXT NOT NULL, client_targets TEXT JSON NOT NULL, status TEXT NOT NULL DEFAULT 'active', is_new INTEGER NOT NULL, source TEXT NOT NULL DEFAULT 'admin', pipeline_summary TEXT NULL, root_path TEXT NULL, created_at TEXT, updated_at TEXT；管理端创建时 source='admin'、is_new 由请求体传入（默认 1）；status 初始为 active（登记态，与列表枚举 active|blocked|completed|unknown 一致）",
  "acceptance": [
    "POST /api/projects 在有效 Session 且用户角色为 admin 或 super_admin 时，接受 body { name_zh, name_en, description, client_targets: string[], is_new: boolean }，校验通过返回 201 与 { id, name_zh, name_en, status, client_targets, is_new, source: 'admin', updated_at }；缺必填或 client_targets 含非法端名返回 400 与可读 errors[]；无 Session 返回 401；operator 或未授权角色返回 403",
    "POST /api/projects 成功创建后，同一项目可通过 GET /api/projects（PROJECT-LIST-001）查到，且 name_zh/name_en/status/client_targets/is_new 与创建响应一致",
    "admin /projects/new 表单展示项目名称（中文）、项目名称（英文）、项目简介、客户端目标多选（选项至少含 admin、backend，与 inputs/req.md 及 prd-spec 一致）、以及标识「新增」的字段（如 is_new 勾选或只读标签）；提交前前端校验必填项，成功跳转 / 或 /projects，失败展示字段级或全局错误",
    "admin 列表页「新建项目」入口仅 admin/super_admin 可见；operator 访问 /projects/new 时被路由守卫拒绝（重定向列表或展示无权限提示），且不得通过 UI 提交创建",
    "表单与 API 请求/响应中不得包含 config.env 中的 API Key 或默认管理员明文密码；创建接口路径为 /api/* Session 鉴权，与 Open API POST /api/v1/projects 分离但共用 projects 表"
  ],
  "constraints": [
    "管理端写接口须复用 AUTH-LOGIN-001 的 require-session；本 feature 额外要求 require-admin-role（admin、super_admin），operator 禁止 POST /api/projects",
    "client_targets 仅允许 prd-spec 声明的 admin、backend，至少一项；请求与入库均为 JSON 数组字符串",
    "端代码仅落在 src/admin/ 与 src/backend/；禁止在 PRD、前端、日志或 API 响应中硬编码 config.env 凭据",
    "与 BACKEND-API-PIPELINE-001 的 POST /api/v1/projects 双通道并存：本接口 source=admin，Open API source=open_api；字段语义一致，避免重复 migration",
    "须兼容 ai-std4 inputs/req.md 用户填写项；创建后不自动写入 pipeline_snapshots，流水线数据由后续上报或看板同步",
    "is_new 为业务标识「新增来源」字段，随创建请求持久化；UI 须让用户感知该状态（勾选或固定为 true）"
  ],
  "dependencies": ["AUTH-LOGIN-001", "PROJECT-LIST-001"],
  "risks": [
    "projects 表 migration 若与 PROJECT-LIST-001、BACKEND-API-PIPELINE-001 的 0002_projects 字段不一致（如缺 source、is_new 类型），会导致管理端与 Open API 创建分叉，codegen 前须合并为单一迁移",
    "admin PRD 验收写 is_new 或 status=new，backend 列表 status 枚举为 active|blocked|completed|unknown；实现时 is_new 表示「新增标识」，登记 status 统一为 active，避免与列表 status 混淆",
    "operator 若仅隐藏按钮但 POST 未鉴权，存在越权创建风险；须前后端双重校验 admin/super_admin",
    "创建成功后若仅跳转列表而未提示 project id，集成调试可接受；若需直达看板可在后续迭代增加「创建并打开看板」"
  ]
}
