{
  "feature_id": "AUTH-USER-001",
  "client_target": "backend",
  "client_targets": ["admin", "backend"],
  "title": "用户管理（管理员创建账号）",
  "phase": "mvp",
  "file_plan": {
    "new_files": [
      { "path": "src/backend/src/middleware/require-admin.ts", "role": "Session 鉴权后校验当前用户 role 为 admin 或 super_admin，否则 403" },
      { "path": "src/backend/src/services/users.ts", "role": "用户列表、创建、更新（邮箱唯一、密码哈希、禁止回显明文）及 bootstrap 账号保护规则" },
      { "path": "src/backend/src/routes/users.ts", "role": "GET/POST /api/users、PATCH /api/users/:id 路由注册" },
      { "path": "src/backend/src/validators/user.ts", "role": "创建/更新请求体校验（email、password、role、status 枚举）" },
      { "path": "src/backend/tests/users.test.ts", "role": "用户 API 的 401/403/201/409 与 bootstrap 保护行为测试" },
      { "path": "src/admin/src/api/users.ts", "role": "listUsers、createUser、updateUser API 封装" },
      { "path": "src/admin/src/components/AdminRoute.tsx", "role": "除登录外要求 role 为 admin 或 super_admin，否则跳转无权限提示或项目列表" },
      { "path": "src/admin/src/pages/UsersPage.tsx", "role": "用户管理页：列表、创建表单、加载/错误空态" },
      { "path": "src/admin/src/components/UserTable.tsx", "role": "用户列表表格（邮箱、角色、状态、创建时间）" },
      { "path": "src/admin/src/components/CreateUserDialog.tsx", "role": "创建用户弹窗/表单：邮箱、初始密码、角色" }
    ],
    "modify_files": [
      { "path": "src/backend/src/index.ts", "role": "挂载 /api/users 路由，链式 require-session + require-admin" },
      { "path": "src/backend/src/db/schema.ts", "role": "补充 users 查询/插入/更新辅助与 role、status 常量" },
      { "path": "src/backend/src/services/bootstrap-admin.ts", "role": "引导创建默认管理员时写入 is_bootstrap=1（或等价标记），供删除/降级保护" },
      { "path": "src/admin/src/App.tsx", "role": "注册 /users 路由，由 ProtectedRoute + AdminRoute 包裹" },
      { "path": "src/admin/src/components/AppHeader.tsx", "role": "导航增加「用户管理」入口（仅 admin/super_admin 可见）" }
    ]
  },
  "api_outline": [
    {
      "method": "GET",
      "path": "/api/users",
      "summary": "管理员会话下分页或全量返回用户 id、email、role、status、created_at（不含 password_hash）；支持 page、page_size 查询参数"
    },
    {
      "method": "POST",
      "path": "/api/users",
      "summary": "管理员创建用户：body 含 email、password、role（默认 operator）；校验邮箱唯一，密码哈希入库；响应仅返回用户摘要，不回显明文密码"
    },
    {
      "method": "PATCH",
      "path": "/api/users/:id",
      "summary": "管理员更新用户 status（active|disabled）或 role（admin|super_admin|operator）；禁止将 is_bootstrap 用户设为 disabled 或降为 operator；不回显密码"
    }
  ],
  "data_outline": "复用 AUTH-LOGIN-001 的 users 表；建议迁移增加 is_bootstrap INTEGER DEFAULT 0（标记环境引导的默认管理员）。字段：id, email UNIQUE, password_hash, role IN (super_admin|admin|operator), status IN (active|disabled), is_bootstrap, created_at。本 feature 不新增 DELETE 接口；禁用通过 status=disabled 实现",
  "acceptance": [
    "GET /api/users 在有效管理员 Session 下返回 200，items 含 id、email、role、status、created_at，无 password_hash；operator 或未登录访问分别返回 403/401",
    "POST /api/users 凭据合法且邮箱未占用时返回 201 与用户摘要；重复邮箱返回 409；响应体与日志不含明文 password；新用户可使用 POST /api/auth/login 登录",
    "PATCH /api/users/:id 可更新非 bootstrap 用户的 status 或 role；对 is_bootstrap=1 的用户禁止 status=disabled 或 role=operator，违规返回 400/403；任意响应不含明文密码",
    "admin 登录且 role 为 admin 或 super_admin 时可访问 /users，列表展示邮箱、角色、状态、创建时间；创建用户成功后列表刷新可见新用户",
    "role 为 operator 的用户访问 /users 时前端 AdminRoute 拦截且 GET /api/users 返回 403；界面与 API 均不展示 config.env 中默认管理员的明文密码",
    "不提供用户删除 API；环境引导的默认管理员（is_bootstrap）不可通过管理端界面删除或禁用"
  ],
  "constraints": [
    "依赖 AUTH-LOGIN-001：复用 users 表、require-session、password 哈希服务；管理端鉴权为 Session/Cookie，/api/users* 不走 API Key",
    "仅 admin、super_admin 可调用用户管理 API 与访问 /users；operator 仅可访问项目相关页（PROJECT-*）",
    "端代码仅落在 src/admin/ 与 src/backend/；禁止在 PRD、前端、日志或 API 响应中硬编码 config.env 凭据",
    "role 枚举与 prd-admin.json 一致：super_admin、admin、operator；创建用户默认 role=operator，仅 super_admin 可授予 super_admin（MVP 可简化为 admin 不可创建 super_admin）",
    "密码仅以哈希存储；POST/PATCH 永不回显明文；bootstrap 管理员由 bootstrap-admin 服务标记，界面无删除入口"
  ],
  "dependencies": ["AUTH-LOGIN-001"],
  "risks": [
    "users 表若未在 AUTH-LOGIN-001 迁移中预留 is_bootstrap，需追加迁移并与已部署环境协调，避免无法识别默认管理员导致误禁用",
    "admin 与 backend 对 role 展示文案不一致时易导致 operator 误以为可管理用户，需在 AdminRoute 与 403 页给出明确提示",
    "MVP admin 侧可能仅实现列表与创建，PATCH 禁用/改角色 UI 若延后实现，须保证后端 PATCH 已就绪以便 standard 阶段补齐（见 prd-review）",
    "批量创建或弱密码策略未在 MVP 强制时存在运维风险，standard 阶段可补充密码复杂度与审计日志"
  ]
}
