{
  "feature_id": "AUTH-LOGIN-001",
  "client_target": "backend",
  "client_targets": ["admin", "backend"],
  "title": "管理员登录与会话",
  "phase": "mvp",
  "file_plan": {
    "new_files": [
      { "path": "src/backend/migrations/0001_users_sessions.sql", "role": "D1 迁移：users、sessions 表及索引" },
      { "path": "src/backend/src/db/schema.ts", "role": "D1 表类型与查询辅助" },
      { "path": "src/backend/src/services/password.ts", "role": "密码哈希与校验（bcrypt 或等效）" },
      { "path": "src/backend/src/services/bootstrap-admin.ts", "role": "部署时从环境变量引导默认管理员（仅首次、不落库明文）" },
      { "path": "src/backend/src/services/session.ts", "role": "会话创建、校验、销毁与 Cookie 属性" },
      { "path": "src/backend/src/services/auth.ts", "role": "登录凭据校验与当前用户摘要" },
      { "path": "src/backend/src/middleware/require-session.ts", "role": "受保护路由 Session 鉴权中间件" },
      { "path": "src/backend/src/routes/auth.ts", "role": "POST login/logout、GET me 路由" },
      { "path": "src/backend/src/index.ts", "role": "Hono 应用入口、CORS（credentials）、挂载 auth 与 bootstrap" },
      { "path": "src/backend/wrangler.toml", "role": "Workers + D1 绑定与 vars 占位" },
      { "path": "src/backend/package.json", "role": "backend 依赖与脚本" },
      { "path": "src/backend/tests/auth.test.ts", "role": "登录/登出/me 与 401 行为测试" },
      { "path": "src/admin/src/api/client.ts", "role": "fetch 封装：credentials include、API 基址" },
      { "path": "src/admin/src/api/auth.ts", "role": "login、logout、me API 调用" },
      { "path": "src/admin/src/context/AuthContext.tsx", "role": "登录态、当前用户、刷新 me" },
      { "path": "src/admin/src/hooks/useAuth.ts", "role": "AuthContext 消费钩子" },
      { "path": "src/admin/src/components/ProtectedRoute.tsx", "role": "未登录重定向 /login，可选保留 returnUrl" },
      { "path": "src/admin/src/pages/LoginPage.tsx", "role": "登录表单页（邮箱/用户名 + 密码）" },
      { "path": "src/admin/src/components/AppHeader.tsx", "role": "顶栏账户区与退出登录" },
      { "path": "src/admin/src/App.tsx", "role": "路由：/login 公开，其余受 ProtectedRoute 包裹" },
      { "path": "src/admin/src/main.tsx", "role": "React 入口与 AuthProvider" },
      { "path": "src/admin/package.json", "role": "admin 依赖与构建脚本" },
      { "path": "src/admin/index.html", "role": "SPA 入口 HTML" }
    ],
    "modify_files": []
  },
  "api_outline": [
    {
      "method": "POST",
      "path": "/api/auth/login",
      "summary": "校验邮箱与密码，成功设置 HttpOnly Session Cookie，返回用户摘要（id、email、role，不含密码）"
    },
    {
      "method": "POST",
      "path": "/api/auth/logout",
      "summary": "销毁服务端会话并清除 Session Cookie；未登录亦可幂等返回成功"
    },
    {
      "method": "GET",
      "path": "/api/auth/me",
      "summary": "有效会话下返回当前用户 id、email、role；无会话或已过期返回 401"
    }
  ],
  "data_outline": "users(id TEXT PK, email TEXT UNIQUE NOT NULL, password_hash TEXT NOT NULL, role TEXT NOT NULL, status TEXT DEFAULT 'active', created_at TEXT); sessions(id TEXT PK, user_id TEXT FK→users.id, expires_at TEXT NOT NULL, created_at TEXT); 默认管理员由 bootstrap-admin 在 users 表 upsert，密码仅存哈希",
  "acceptance": [
    "POST /api/auth/login 凭据正确时返回 200、Set-Cookie（HttpOnly、Secure、Path=/、跨子域 SameSite 策略与 admin/api 域名一致）及用户摘要；错误凭据返回 401 与通用错误文案，响应与日志不含密码明文或「默认账号」提示",
    "admin 登录页提交成功后跳转项目列表（/ 或 /projects）；失败展示明确错误；顶栏「退出登录」调用 POST /api/auth/logout 后清除本地态并回到 /login",
    "未携带有效会话访问 admin 受保护路由时重定向 /login；浏览器刷新后仍保持登录直至过期或登出（与 GET /api/auth/me 及 Cookie 一致）",
    "未登录或会话失效时调用受保护 backend 接口（含 GET /api/auth/me）返回 401；POST /api/auth/logout 后旧 Cookie 无法再访问 me",
    "默认管理员仅由部署环境变量（如 ADMIN_EMAIL、ADMIN_PASSWORD，名称在 wrangler/Workers 绑定中配置，禁止写入 PRD、前端或仓库）在首次启动时引导创建；接口与日志永不回显 config.env 中的明文密码"
  ],
  "constraints": [
    "管理端鉴权为 Session/Cookie；集成 Open API（/api/v1/*）本 feature 不实现，后续 feature 使用 API Key",
    "端代码仅落在 src/admin/ 与 src/backend/；禁止在 PRD、前端代码、日志或 API 响应中硬编码 config.env 凭据",
    "backend 部署于 api.dash.ai-ww.com，admin 于 admin.dash.ai-ww.com；CORS 须允许 credentials 且 Origin 白名单仅含管理端域名",
    "须兼容 ai-std4 目录约定；本 feature 为后续 AUTH-USER-001、PROJECT-* 的会话基础，require-session 中间件供管理 API 复用",
    "密码仅以安全哈希存储；sessions 表记录过期时间，服务端校验优先于仅信客户端状态"
  ],
  "dependencies": [],
  "risks": [
    "admin 与 api 跨子域 Cookie 需统一 Domain（如 .dash.ai-ww.com）与 SameSite=None; Secure，本地 wrangler/pages 预览域名不一致时易导致「登录成功但 me 401」",
    "Cloudflare Workers 无传统内存 Session，须依赖 D1 sessions 表；高并发下需注意会话清理与过期扫描策略（MVP 可按 expires_at 惰性校验）",
    "环境变量引导默认管理员若与已存在用户冲突，须定义幂等 upsert 规则，避免重复初始化或覆盖管理员密码哈希"
  ]
}
